{
  "$schema": "../formats/apex-drive-track.v1.schema.json",
  "format": "apex-drive-track",
  "formatVersion": 1,
  "track": {
    "number": 3,
    "id": "circuito-vector",
    "name": "Circuito Vector",
    "version": "1.0.0"
  },
  "assets": {
    "visual": {
      "format": "procedural",
      "generator": "circuito-vector-v1.0.0-tire-development-loop",
      "uri": null
    },
    "collision": {
      "format": "generated",
      "uri": null
    }
  },
  "configuration": {
    "profile": "apex-drive",
    "profileVersion": 1,
    "coordinateSystem": {
      "unit": "meter",
      "upAxis": "Y",
      "handedness": "right"
    },
    "start": {
      "position": {
        "x": 0,
        "y": 0.05,
        "z": -70
      },
      "yawRadians": 3.141592653589793
    },
    "geometry": {
      "roadWidthM": 14,
      "shoulderWidthM": 8,
      "groundHeightM": 0,
      "roadThicknessM": 0.08,
      "boundaryMode": "guardrails",
      "roadsideMode": "adaptive-terrain"
    },
    "timing": {
      "startRadiusM": 8,
      "checkpointRadiusM": 12,
      "checkpointIntervalPoints": 12,
      "ignoredTailPoints": 5,
      "sectorCount": 6,
      "storageKey": "apex-run.v3.circuito-vector-lap-timing.v1-tire-development-loop"
    },
    "surfaces": {
      "road": "asphalt",
      "shoulder": "grass",
      "ground": "grass"
    }
  }
}
